,title,funder,investigator,abstract,funding_amount_usd,start_year,end_year
0,Mid-infrared metasurface VECSELs,Defense Advanced Research Projects Agency,to Benjamin Williams,"The goal of this proposal is to develop quantum-cascade (QC) vertical external cavity surface emitting lasers (VECSELs) in the mid-infrared spectral range based upon gain-loaded metasurfaces. This is proposed a path for (a) high brightness mid-IR sources with scalable output power (up to tens of Watts) in a circular diffraction limited beam, and (b) a platform for multifunctional lasers associated with the ability to locally engineer the amplitude, phase, and polarization response of the metasurface. The specific goal of one year program is a proof of concept demonstration of a metasurface VECSEL in the LWIR range (i.e. 8-12 micron). If initial demonstration is successful, we will investigate metasurface VECSELs with dynamically switchable output polarization, as an example of the multi-functional laser concept. The VECSEL is an attractive architecture to achieve high-power single-transverse-mode operation with excellent Gaussian beam quality. While desirable, the VECSEL concept could not ordinarily be implemented for a quantum-cascade laser, because the intersubband selection rule prevents interaction of the gain medium with surface incident radiation. Our group has recently demonstrated the first quantum-cascade VECSEL in the THz frequency range by using a novel metasurface made up of sub-wavelength antenna-coupled sub-cavities loaded with QC-laser gain material; this creates an active amplifying mirror which serves as one mirror in an open cavity. Here we propose to demonstrate the metasurface QC-VECSEL approach in the mid-infrared range. The technological impact is potentially high, as both sensing applications and infrared countermeasures demand high performance mid-IR sources. Novelty lies in the fact that the THz approach cannot simply be scaled to the mid-IR Ð the metallic losses would become excessive and prevent operation. Instead we propose several new schemes for low-loss QC metasurfaces based upon plasmonic and all-dielectric approaches.less","149,984",2016,2018
0,"Vibration imaging for the characterization of extended, non-cooperative targets",United States Department of the Air Force,to Troy Rhoadarmer,"Locating objects that vibrate is a way to discern potential threats and locate targets. However, current vibrometry technology typically measures only the global vibration of target and cannot create an extended spatial measurement of the vibration profile of the target. These solutions cannot identify what the target is, nor can they locate potential weak spots on the target, because they lack spatial information about the target. Guidestar is proposing to generate spatial vibrometry images using a digital holography system. By sampling at high rates, the target information captured using digital holography can be used to compute a vibration image. The vibration measurements will be extracted from phase signals heavily degraded by scintillation and speckle using UCLA system identification and filtering algorithms. By combining Guidestarâ€™s expertise in optical systems and real time processing and UCLAâ€™s signal processing and filtering techniques, the proposed approach will seek to generate reliable full vibration target images of simulated target imagery.less","149,972",2019,2020
0,Multiferroic Small Antenna,United States Department of the Air Force,to Yakup Bayram,"ABSTRACT: PaneraTech, in partnership with UCLA, is proposing to develop an extremely small UHF antenna based on Multiferroics. The Multiferroic (MF) concept allows for a sub-wavelength (less","149,736",2014,2015
0,Scaled Transonic Dynamic Aeroelasticity Through Wind Tunnel Testing (ST-DAWTT),United States Department of the Air Force,to Alan Arslan,"ABSTRACT: Under this collaborative effort, Creative Aero Engineering Solutions (CAES) and its academic partner University of California Los Angeles (UCLA) are pleased to team on the research entitled""Scaled Transonic Dynamic Aeroelasticity through Wind Tunnel Testing (ST-DAWTT),""consisting of a novel approach for characterizing the transonic aeroelastic environment of a full-scale fighter in the wind-tunnel (WT). Under phase I, the team will explore the feasibility of such an environment though the design of aeroelastically scaled wind tunnel models. At least one of the models will serve as a benchmark of Computational Science and Engineering (CSE) tools. The experimental data sets obtained during Phase II will enable the designer to optimize aeroelastic stability margins and control effectiveness in the early stages of conceptual and preliminary design, replacing costly trial and error approaches. This capability will not only result in more optimal designs, but will also mitigate the risks associated with the development of future high-speed aircraft by avoiding aeroelastic surprises during flight tests. The documented process shall be rendered robust and repeatable to the point of fast and affordable""on-demand""manufacturing for future commercialization purposes during Phase III. BENEFIT: Commercial applications involve : * Enhanced Finite Element Analysis (FEA) and Computational Fluid Dynamics (CFD) methods for non-linear fluid structure interactions (unique capability to transition to government and aerospace industry) * Fast wind-tunnel aeroelastic wind-tunnel model manufacturing capabilities that could be generalized to design, validaion, and testing of full scale morphing Uninhabited Air Vehicles ( UAV)less","149,722",2013,2013
0,Rapidly and Broadly Tunable High-Power Infrared Lasers for Standoff Detection Applications,United States Department of the Army,to Arkadiy Lyakh,"In response to the Army STTR Topic A14A-T015 solicitation for tunable high-power LWIR lasers for standoff detection applications, Pranalytica proposes to develop a compact, rugged and highly reliable wavelength tunable quantum cascade laser (QCL) module delivering over 5W of peak power and over 0.5W of average power in the spectral region spanning from 7 to 11µm. The proposed approach is based on a new external cavity configuration, not used for QCLs heretofore, and offers several critical advantages, over either the QCL arrays or the traditional grating external cavity QCL, for practical field applications, including rapid wavelength tuning, high manufacturing yield, and compatibility with standard QCL packaging. Unprecedented combination of the projected operational characteristics of the module will pave the way to a new generation of standoff detection systems.less","149,663",2014,2015
0,Multisensor-Integrated Organ-on-a-Chip,United States Department of the Air Force,to Sivaram P Gogineni,"The Air Force seeks three-dimensional bioprinted tissue that can accurately replicate complex multi-cell function and that can be integrated with biosensors. To address this need, Spectral Energies in collaboration with Prof. Khademhosseini of the University of California, Los Angeles (UCLA) proposes to develop an organ-on-a-chip system. The organ-on-a-chip system will be capable of accurately modeling the important biological and physiological parameters and will be capable of providing measurements from multiple biosensors. The system will also allow for the coupling of multiple tissue types, i.e. heart and liver. In addition, the system will be small and light weight for portability.less","149,651",2019,2020
0,Configurable Anthropomorphic Robot to Assess Threat-modulation of Trust in Machine Agents,United States Air Force,to Christopher Holbrook,"An emerging corpus of research indicates that threatening situations lead individuals toconceptualize members of their coalitions as more mentally human. Relatedly, research alsoshows that machine agents are intuitively anthropomorphized as possessing human mentalcharacteristics, and are increasingly enmeshed as quasi-members of military teams. Anecdotally,for example, soldiers have been known to name and even mourn the loss of explosive ordnancedisposal robots, and recent neuroscientific research confirms that machine agents areconceptualized using some of the same neural mechanisms as those employed in social reasoningabout the mental states of other human beings.less","141,481",2017,2018
0,"Rapid imaging, detection and quantification of Giardia lamblia cysts using mobile-phone based fluorescent microscopy",United States Department of the Army,to Aydogan Ozcan,"The objective of the proposed work is to enable rapid real time screening of waterborne pathogens in remote locations and field settings. The investigators will work to develop a smartphone based pathogen quantification platform for specific imaging and detection of Giardia lamblia cysts in water samples. Specifically they propose to improve the cyst capture efficiency, to enhance the specificity and sensitivity of the digital analysis and cyst recognition software, and to experimentally evaluate the system on different device platforms. They will also create and test pre-filtration systems that remove debris and other extraneous larger particles often found in dirty water.less","135,326",2015,2016
0,Spatial variability in aeolian abrasion,United States Department of the Army,to Mackenzie Day,"Wind-driven sediment transport dominates arid landscape evolution. In particular, wind-blown sand forms vast dune fields and erodes exposed surfaces through abrasion. Abrasion requires that sand is entrained by the wind, and aeolian dunes often serve as a sand source for abrasion. However, the relationship between the magnitude of abrasion and distance from a sand source remains poorly constrained. Previous work on aeolian abrasion has focused on ventifacts, wind-carved cobbles and boulders that record the direction of erosive winds in their pattern of surface erosion. These geologic indicators provide robust evidence that wind-abrasion has occurred, but without more information provide little information about the magnitude or rate of surface erosion. At the moment, sources of sand are easy to identify (e.g., dune fields, sand sheets), but the expected erosion rate on materials places some distance away is unknown. Aeolian abrasion can cause significant damage to both natural and engineered materials, but sometimes proximity to sand sources is unavoidable. A quantitative understanding of how aeolian erosion rates vary with material type and distance from a dune field would facilitate better-informed decision making in arid regions, and provide an expected rates of degradation from aeolian abrasion that could be used in planning and risk management. The proposed work aims to address this gap in knowledge. Objective: Quantify the magnitude of aeolian abrasion as a function of distance away from a sand dune source. Technical approach: To determine quantitatively how abrasion varies distally away from a dune field, we propose a 12- month field experiment in which we monitor the wind conditions in the field, capture saltating sand causing abrasion, and measure progressive abrasion-related mass loss on a variety of natural and synthetic materials at increasing distance from the dune field. The proposed work is divided into three major tasks completed over a total of 18 months. Preparatory assembly of sampling devices and initial deployment of those devices in the field (Task 1a) will be conducted at the beginning of the proposal period. Ventifacts in the area will also be mapped as a proxy for geologically recent winds (Task 1b). For the next 12 months, the field area will be visited regularly to track progressive abrasion and monitor the winds and sediment flux (Task 2). Data analysis (Task 3) will be conducted after the 12 months of monitoring. We hypothesize that abrasion decreases linearly away from a sand source. This hypothesis can be directly tested with the proposed field measurements and geologic interpretation. The patterns and magnitude of abrasion at each sample site will provide data to quantify the relationship between distance from the sand source and abrasion date. Additional contextual information will refine the scientific interpretation of these results.less","130,821",2021,2022
0,Efficient Mid-Wave Infrared Quantum Cascade Lasers with Room-Temperature Wall-Plug Efficiency over 40%,United States Department of the Navy,to Robin Huang,"For this program Forward Photonics will be teaming with UCLAs Terahertz Devices and Intersubband Nanostructures Laboratory for the modelling and design of the active regions of new QCL devices with wall-plug efficiency > 40%. During this program, we will grow, fabricate, package, and test QCL devices with this improved design targeting the high efficiency levels.less","125,000",2017,2018
0,Optimizing Catalyst Performance in Proton Exchange Membrane Fuel Cell Stacks through Increasing Cell,United States Department of the Navy,to Yu Huang,"We are seeking funds for a proton-exchange-membrane fuel cell (PEMFC) stack testing system containing a high-power PEM fuel cell tes,t station and a PEMFC stack. This system will complement with our existing strength in nanomaterial synthesis and their applications, in electrocatalysis (mostly related to sustainable energy technologies), and enable us to conduct direct, efficient, and comprehens,ive evaluation of our ongoing new materials for their practically relevant performance in PEMFC stack. It will significantly facilit,ate our ongoing research on Advanced Highly Efficient Fuel Cells Based on Designer Catalysts, which is supported by the Office of,Naval Research.PEMFCs efficiently generate electricity without combustion and resemble key elements of a broad portfolio for buildin,g a sustainable clean energy economy. The fuel cell industry has witnessed tremendous growth within the past decade. Despite the gre,at market growth, the broad dissemination of PEMFCs into the enormous transportation market is still limited by the high cost origin,ated from the high loading of platinum group metals (PGM) for fuel cell reactions. Therefore, translating the state-of-the-art catal,ysts developed in laboratories into PEMFCs would greatly improve energy efficiencies and reduce PGM usage associated costs. With ONR, support, the UCLA group has developed various designer nanocatalysts for the PEMFC cathode oxygen reduction reaction (ORR) with muc,h higher activity and stability than the commercial ones, some of which even set the record of activities for ORR catalysts. Moreove,r, these designer catalysts have been incorporated into membrane electrode assemblies (MEAs) showing exceptional performance meeting, all DOE set targets for high-performance and low cost PEMFCs for light duty vehicles. However, the state-of-the-art ORR catalysts,tested in MEA come with inherent limitations as the set of engineering issues the catalysts face may differ in a more realistic PEM,stack. Evaluating the catalyst performance in realistic working environment in PEMFC stacks is critical for the practical disseminat,ion of these high-performing PEMFCs. Hence we propose to acquire PEMFC stack test system, including a high power PEMFC test station,and a PEM stack, to incorporate, evaluate and optimize the state-of-the-art catalyst system in practical working environment for bro,ad dissemination of high-performance and low-cost PEMFCs. Through the evaluation and translation process from bench-to-production, g,raduate students and postdoctoral researchers will have the unique opportunities to engage in technical development, market analysis,, and communication with industrial partners, which can prepare them to become future STEM leaders and entrepreneurs. This acquisiti,on will also be a wonderful educational tool to engage students in the studies of sustainable energy technologies in realistically r,elevant conditions, and to engage them in research activities that aim for industrial instrumentation and operations. The proposed s,tudies based on PEMFC stack test station open new opportunities for systematic studies and design of biomaterial, soft materials and, composites that closely correlate to real function conditions. The outcome has the potential to generate new avenues in scientific,discoveries and technological applications and can impact broad future technologies relevant to DoD missions ranging from nanoscale,catalysis, biotechnology to renewable energy, novel electronics and sensors.less","120,285",2022,2023
0,Impacts of submesoscale turbulence and internal waves on the energetics of the Atlantic Ocean,United States Department of the Navy,to James McWilliams,"The ocean is highly turbulent, with motions spanning a wide range ofspatial and temporal scales, all interacting together. The geostrophiceddy field, at horizontal scales of order 100 km, contains most of theocean kinetic energy. Such #balanced# motions tend to aggregate intolarger scales, following an inverse cascade of energy. However, alarge part of the energy dissipation needs to happenat much smallerscales. But how energy is transferred from the large scales to thevery small scales are still an open question. Submesoscale currents (1- 10 km) processes can provide a relaxation from the strictgeostrophic balance. They can extract energy from geostrophic flowsand transfer it to unbalanced motions, from where it may be cascadedto smallest scale where irreversible molecular mixing takesplace. Internal waves may also extract energy from the mesoscale orsubmesoscale currents. This collaborative project willinvestigatethese processes in high-resolution, high-frequency simulations of theAtlantic Ocean.less","113,194",2023,2024
0,Development of a Renormalization Group Approach to Multi-Scale Plasma Physics Computation,United States Department of the Air Force,to John Luginsland,"Multiple scale simulations are among the most challenging calculations in scientific computation, yet this capability is critical to realizing a virtual prototyping capability for devices based on electromagnetic and plasma technology. One solution to multi-scale problems is the renormalization group (RNG), which offers a systematic means to investigate and couple the impact of mutiple scales together. NumerEx and UCLA will apply RNG to a class of tractable, yet non-trivial plasma physics problems to develop robust techniques to simulate multiple scales in plasma physics problems. New numerical algorithms based on these new techniques will be designed.less","100,000",2007,2007
0,Thermally Remendable Composite Structures with Resistive Heating Network of Carbon Fibers,United States Department of the Air Force,to Thomas Darlington,"Carbon fiber-reinforced composites undergo subcritical damage well before final failure. A self-healing composite material is proposed that will autonomously sense and repair localized damage in composite structures.  Healing is accomplished via two main components.  The first component is a thermally remendable polymer matrix that is integrated into the structural carbon fiber composite and has the ability to be healed with the application of heat. The second component is an addressable conducting network (ACN) that will both sense resistance changes due to damage in carbon fiber composites as well as deliver current for resistive heating to addressable locations within the composite. A health management system will continuously monitor the health of the structural composite and will determine the location and extent of detected damage as well as the potential for autonomous repair.   BENEFIT: The proposed technology provides a solution to the serious problem of detecting and repairing impact, delamination and microcracking damage in aircraft and vehicles.  Currently, such damage can go undetected resulting in a compromised structure that can endanger personnel and reduce mission readiness.  The software developed in conjunction with the novel structural designs developed within this program will allow maintenance personnel to continuously monitor the health of composite structures. When damage is detected, a healing procedure can be initiated to rapidly restore the integrity of the structure. Commercial and military aircraft are increasingly constructed from carbon fiber, and the proposed monitoring and healing technology will reduce maintenance cost and increase service lifetimes of composite air frames.  The ability to monitor the health as well as address structural issues remotely will provide an unprecedented ability to maintain inaccessible composite structures such as satellite and space vehicles.)less","100,000",2009,2010
0,High Risk Rapid Ethnographic Assessment Tool (HRREAT),United States Department of the Army,to Amos Freedy,"This proposal is to develop a High Risk Rapid Ethnographic Assessment Tool (HRREAT) that will provide commanders and their staff with a fully-integrated, user-friendly suite of tools for the rapid collection, management, analysis, modeling, and visualization of ethnographic data in denied areas to enhance planning and decision making activities. Ethnographic data has become highly important in counterinsurgency as well as in conventional combat planning and decisions. While there are many existing and new tools that can help military personnel rapidly gather such data even in risky and/or denied areas, the potentially available tools are not integrated into one accessible system and are not easily used by non-specialist personnel. Moreover, ethnographic analyses are most often divorced from overall planning and decision making. Our solution to these problems is to combine a number key social network, planning and decision support components that we are developing in several closely related SBIR projects with new ethnographic analysis components. This will create a customized and productized tool suite that enhances ethnographic data collection and analysis and visualization, puts the data into a planning and decision making framework, and most important can be quickly transitioned to operational users, both in the military and in commercial environments.less","100,000",2011,2011
0,Adaptive Visualization of Social Networks (ADVIS),Defense Advanced Research Projects Agency,to Amos Freedy,"This proposal is to develop a new system for Adaptive Visualization of Social Networks (ADVIS). Numerous social network visualization systems have been produced in recent years. But even in the few top systems cognitive science and design principles have been applied in an ad hoc and non-systemic manner. Accordingly, each visualization system is a one-of, which may be fine-tuned to a particular user goal and data set, but which can not adapt to rapidly changing user goals, data sets and visualization techniques. In our new approach, visualizations will be automatically generated based on user-defined goals, data set characteristics, and first principles in cognitive science. This will be a systematic and rigorous process, in which various visualization techniques are evaluated based on their utility for the current user goals and data set, as well as the compatibility of their underlying cognitive premises. The key innovation in our system is the explicit inclusion of all of these factors in an automated design process through the use of taxonomies for cognitive principles, visualization techniques, and user-goals. ADVIS will permit user-goals and visualization techniques to be specified and added to the system, so that optimal visualizations can be rapidly produced.less","100,000",2012,2012
0,High Efficiency Flexible Photovoltaic Blankets,United States Department of the Air Force,to Noren Pan,"ABSTRACT: MicroLink proposes a device that combines ultra-thin, high-efficiency, GaAs-based multijunction solar cells, made using our proprietary epitaxial lift-off (ELO) process, with a novel packaging approach that will result in high-efficiency, flexible photovoltaic blankets. MicroLink has developed a process that produces ultra-thin, flexible solar cells. In this project, these flexible solar cells will be incorporated into a flexible, polymeric solar sheet. The net result will be a sheet that has a high net solar conversion efficiency and that can be rolled or folded. BENEFIT: The ability to integrate highly flexible solar cells would provide a clear pathway towards the realization of a high efficiency solar blanket. Key areas of development to be accomplished in Phase I include interconnects, welding, and thin film packaging. The development efforts would lead to lightweight solar-powered battery charging units with widespread commercial potential in applications such as powering consumer electronics, sports, and camping.less","100,000",2011,2011
