,title,funder,investigator,abstract,funding_amount_usd,start_year,end_year
0,Enabling dissipation-less electronics with hydrodynamic transport in materials,United States Department of the Navy,to Prineha Narang,"Transport phenomena, the irreversible processes driving physical systems towards equilibrium, underpin much of the complexity of the, natural world. The transfer of charge, heat, and spin in materials is governed by transport processes. Therefore, functional contro,l of materials relies on an understanding of these processes, making transport an essential ingredient of energy technologies, elect,ronic device design, and optimization of power systems. Our primary objective in this ONR YIP is to harness a fundamental understand,ing of electron and phonon transport in functional materials to design and optimize new dissipation-less devices for power and energ,y technology through the following: Thrust #1: A theoretical and computational framework for spatially-resolved coupled transport ca,lculations of electrons and phonons, and Thrust #2: Hydrodynamic transport in materials for energy-efficient and dissipationless ele,ctronics. This program introduces architectures for dissipation-less electronic devices that leverage hydrodynamics, the collective,flow of electrons in materials akin to classical fluids, and unconventional transport phenomena. Specifically we will (1) combine ca,lculations of carrier dynamics with transport in complex materials, (2) develop and apply approaches to spatially-resolved electron,and phonon transport within the Spatially Resolved Transport of Non-equilibrium Species (SpaRTaNS) framework, and (3) predict at the, device- and system-level optimized power electronics and energy-efficient devices, pushing the mesoscale limit to larger micrometer,-scale devices, linking our SpaRTaNS calculations with electronic circuit simulation software such as SPICE. In contrast with classi,cal fluids, preferred directions in crystalline materials introduce additional viscosity tensor contributions, including the dissipa,tionless Hall-viscosity component giving rise to isentropic flows, which do not dissipate heat and energy. The proposed ONR YIP syn,thesizes state-of-the-art ideas in materials science, condensed matter and computational physics, electronic devices, and thermal en,gineering in power and energy technology. Understanding electron transport plays a key role in designing advanced electronic devices,, phonon transport dictates thermal management, thereby playing an important role in optimizing power-dense devices, and hydrodynami,c transport could realize entirely new energy-efficient, dissipation-less electronics. Naval Power and Energy Systems play a critica,l role in enabling new naval capabilities. Outcomes of our program directly addresses power and energy S&T needs in (1) increased el,ectrical conductor current carrying capacity and loss reduction, (2) reducing the size and footprint of electric machines, enabling,high efficiency, highpower-dense electrical systems, and (3) increased thermal conductivity, and reduced sensitivity to temperature., Further, our proposed fundamental work on thermal-transport and non-uniform current density heat-dissipation would enable new desi,gns of resilient energy technologies, aligned with the Navy's recently released goals in climate change adaptation and resilience in, the Climate Action 2030 strategy.less","750,000",2022,2025
0,Integrated Resource Management for Real-time Multimedia Communications in Highly Mobile Networks.,United States Department of the Navy,to Izhak Rubin,"We will implement integrated system management functions for Unmanned Vehicle (UV)-aided networked systems. Such systems employ wireless networks that support mixtures of applications, supporting multimedia streams and critical C4ISR flows. The goal isto develop technologies and methods to rapidly configure and manage these networks so that they can share and disseminate critical data in realtime and to ensure that quality of service (QoS) measures are met. In Phase I, we have developed systemmanagement methods for Mobile Backbone Network (MBN) based multi-tier ad hoc wireless networks. In Phase II, these techniques will be used for the development of system management (ISM) operation for systems that combine sensor networks, MBN basedcommunications networks and unmanned (airborne and ground based) vehicles. We will define, analyze, simulate and test-bed demonstrate: Management Information Bases (MIBs) that will store the attributes of the underlying managed entities; Tasking &Management Interfaces (TMIs) that will allow management entities to monitor, control and task the managed objects; Management application routines that calculate the best action to follow and methods to employ in allocating overall system resources.Under a Phase II Option, the integrated system management operation will be extended to incorporate multitasked UAV SWARM formations. Next generation highly mobile wireless systems combine the operation of sensor and communications networks. These systemsemploy a dynamically configurable structure, utilizing ground and airborne based unmanned vehicles (UAVs and UGVs). UAV SWARM formations will be configured, using multi-tasked platforms that provide networking and sensing services, to execute a multitudeof missions. We have proposed a scalable and manageable architecture that will provide for the implementation of such networks, based on our recently developed mobile backbone network (MBN) concepts. Since the underlying mission and operationalenvironment is continuously changing, it is essential that a resource management system is employed to monitor, control, and manage the system and to allocate in realtime system resources. There are no current distributed software agents and integratedresource allocation tools that can operate in realtime for such networks. Our proposed architecture and methods for the implementation of such an Integrated System Management (ISM) operation will ensure that the system management operation reacts inrealtime to changing mission requirements and to fluctuating system/environmental conditions. Such intelligent models and software agents must be employed to connect the network monitoring functions with the system control mechanisms, to ensure realtimeadaptivity and a survivable operation. The integrated system management structure and software to be developed is of key importance for ensuring a responsive and survivable operation of ad hoc wireless networks, homeland security systems, C4ISR FORCEnet,disaster relief networks, industrial control systems, geological and urban traffic control networked systems and any communications network system that integrates that sensing and telecommunications operations.less","750,000",2002,2003
0,Thermally Remendable Composite Structures with Resistive Heating Network of Carbon Fibers,United States Department of the Air Force,to Thomas Darlington,"ABSTRACT: Carbon fiber-reinforced composites undergo subcritical damage well before final failure. A self-healing composite material is proposed that will autonomously sense and repair localized damage in composite structures. Healing is accomplished via two main components. The first component is a thermally remendable polymer matrix that is integrated into the structural carbon fiber composite and has the ability to be healed with the application of heat. The second component is an addressable conducting network (ACN) that will both sense resistance changes due to damage in carbon fiber composites as well as deliver current for resistive heating to addressable locations within the composite. A health management system will continuously monitor the health of the structural composite and will determine the location and extent of detected damage as well as the potential for autonomous repair. BENEFIT: The proposed technology provides a solution to the serious problem of detecting and repairing impact, delamination and microcracking damage in aircraft and vehicles. Currently, such damage can go undetected resulting in a compromised structure that can endanger personnel and reduce mission readiness. The software developed in conjunction with the novel structural designs developed within this program will allow maintenance personnel to continuously monitor the health of composite structures. When damage is detected, a healing procedure can be initiated to rapidly restore the integrity of the structure. Commercial and military aircraft are increasingly constructed from carbon fiber, and the proposed monitoring and healing technology will reduce maintenance cost and increase service lifetimes of composite air frames. The ability to monitor the health as well as address structural issues remotely will provide an unprecedented ability to maintain inaccessible composite structures such as satellite and space vehicles.less","749,999",2010,2011
0,Phase I Proposal #B045-014-0221: Target Scene Resolution and Calibration Using Innovative Region Based Active Contour Techniques,Missile Defense Agency,to Berta Sandberg,"Given the stressing timelines of KEI, there is a need to quickly and accurately determine the precise location of the physical centroid of a ballistic missile hard body in order to find the desired point of intercept for the kill vehicle. During terminal homing, when the interceptor relies on its IR seeker, there are many events within the seeker field of view (FOV) that can contribute to a failure to intercept. Some major events and associated IR image phenomena are: (1) Booster intensity overwhelming the intensity of the hard body, (2) re-entry vehicle (RV) separation from a post boost vehicle (PBV), and (3) transient shock wave for an endo-atmospheric intercept. Our algorithms differentiate several objects of different intensities, using the image data directly to find the centroid of the hard body. In this context, the only detection heuristic is that there may be more than one object within the images. The proposed image processing algorithms will be combined in Phase II in an integrated fashion with the physical dynamics of the plume, shock wave, and hard body. Our algorithms include feature detection, identification, and tracking. Approaches that we investigated in the Phase I include the following: (1) image segmentation (active contour methods) to detect the separate parts of the boosting missile, (2) use of the object region rather than edge information for tracking, (3) consideration of image noise, and (4) use of shapes for further discrimination and classification. This approach has been successfully demonstrated in a laboratory environment on medical MRIs and commercial aviation applications, as well as on data generated by missile simulation programs CHARM and CHAMP. We have demonstrated in Phase I that our region based active contour techniques are robust under noisy conditions. We have also demonstrated that our algorithms are general and flexible, and can be used for single or multi-color seekers and different bandwidths with minimal parameter modifications. For a multi-color case, each color can be processed independently or in parallel, and the images fused subsequently. Or, the multi-color image can be processed simultaneously to render a single segmented result. In addition to the KEI PTHH problem, the imaging algorithms and prototype software that we developed in Phase I were applied to RV midcourse aim point selection rendering promising results also. The key feature of our approach is that it is a general and robust image recognition/segmentation technique that is applicable to an EO/IR sensor in the BMDS environment. During Phase I of this STTR, we worked closely with the MDA Project Hercules and major DoD contractors, who have endorsed our study for STTR Phase II. We intend to develop core and generic capabilities using innovative active contours techniques during Phase II to help solve the challenging problem of PTHH in boosting targets. Based on promising preliminary results in Phase I, we believe we can tailor our algorithms in Phase II and apply them successfully to the RV aim-point selection problem in mid course and terminal phases of flight, as well as to Target Object Mapping (TOM). Our objective is to develop detailed algorithms and tools for potential insertion into BMDS block upgrades and for use in other domains, focusing on missile/air defense applications in Phase II. We intend to extend our approach to non-DoD government applications and to private sector commercial markets in Phase III, in particular using this technology in the medical diagnostic fields (which the UCLA Medical School has shown great interest in collaboration) such as cancer and cardiovascular disease diagnostics.less","749,996",2005,2006
0,Stable High Bandwidth AO Control with physical DM constraints,United States Department of the Air Force,to Troy Rhoadarmer,"Adaptive optics (AO) can compensate for the aberrating effects of atmospheric turbulence which degrade the performance of high energy laser (HEL) weapon systems and, as such, is an enabling technology for effective deployment of HEL weapon systems. A key component in an HEL AO system is the deformable mirror (DM). However, mechanical constraints in currently available DMs limits AO system performance in stressing engagements. Guidestar teamed with UCLA to develop methods that can provide AO performance with a constrained DM that is comparable to performance with an ideal DM that does not have these physical constraints. Guidestar developed a conjugate gradient method that determined an optimal DM command without violating hardware limitations in a woofer-tweeter control architecture. This method tied together within an adaptive Model Predictive Control (MPC) framework developed by UCLA. In this proposed Phase II program, Guidestar and UCLA will advance the development of these approaches, creating a complete control architecture to provide optimal AO correction using a DM that is constrained by total stroke saturation and inter-actuator stroke limits. Our approach will be validated through modeling and simulation, as well as scaled laboratory testing of the DM control methods.less","749,979",2019,2021
0,Stable High Bandwidth AO Control with physical DM constraints,United States Department of the Air Force,to Troy Rhoadarmer,"Adaptive optics (AO) can compensate for the aberrating effects of atmospheric turbulence which degrade the performance of high energy laser (HEL) weapon systems and, as such, is an enabling technology for effective deployment of HEL weapon systems. A key component in an HEL AO system is the deformable mirror (DM). However, mechanical constraints in currently available DMs limits AO system performance in stressing engagements. Guidestar teamed with UCLA to develop methods that can provide AO performance with a constrained DM that is comparable to performance with an ideal DM that does not have these physical constraints. Guidestar developed a conjugate gradient method that determined an optimal DM command without violating hardware limitations in a woofer-tweeter control architecture. This method tied together within an adaptive Model Predictive Control (MPC) framework developed by UCLA. In this proposed Phase II program, Guidestar and UCLA will advance the development of these approaches, creating a complete control architecture to provide optimal AO correction using a DM that is constrained by total stroke saturation and inter-actuator stroke limits. Our approach will be validated through modeling and simulation, as well as scaled laboratory testing of the DM control methods.less","749,979",2019,2021
0,Efficient Multi-Scale Radiation Transport Modeling,United States Department of the Air Force,to Ramakanth Munipalli,"Radiative heat transfer is a dominant mode of heat transfer in combustion and propulsion systems as well as for hypersonic flow encountered during planetary entry. Solution of the Radiative Transfer Equation (RTE), which is an integro-differential equation, places stringent requirements on the computational resources as: (a) the radiation depends both on spatial and angular dimensions, (b) radiation transfer occurs over a wide spectral range (multi-group), and (c) the participating often exhibits strong dependence on the local flow properties leading to a wide variation in the optical thickness (multi-scale). Efficient numerical algorithms and solvers to address issues of accuracy and computational time are much needed. In this proposal, we seek to unite two powerful techniques in contemporary scientific computing: (1) The discontinuous Galerkin methods, and (2) Graphical processor (GPU) programming, with advances in the prediction of radiative gas dynamics. HyPerComp Inc. has teamed with subject-matter experts, UCLA – who would provide their expertise in development of radiation gas models and validation cases, and Brown University – who would provide their expertise in GPU computing specialized for DG methods to expand upon HyPerComp’s core expertise in developing innovative algorithms and techniques in high-performance-computing, commercialization and distribution for industrial use through strategic partnerships. BENEFIT: The proposed research would result in major breakthrough and a paradigm-shift in how radiative transport equation is solved, from using CPUs to using GPUs, which would be cheaper and at the same time order of magnitude faster. A fast, robust, and accurate RTE solver would find numerous commercial applications such as analysis of exhaust gases in stationery power plants, simulation of photobioreactors to accurately modeling light absorption and scattering by microorganisms and bubbles, radiative analysis of furnaces to minimize energy loss and pollution emissions etc., as well as military and aerospace applications related to thermal analysis of combustion and propulsion systems and target detection and identification (remote sensing).less","749,975",2010,2012
0,Electrically Small Multiferroic Antennas,United States Department of the Air Force,to Yakup Bayram,"ABSTRACT: During Phase I, PaneraTech in partnership with UCLA-TANMS (NSF Center for Translational Applications of Nanoscale Multiferroic Systems) achieved a groundbreaking success by designing a multiferroic small antenna based on continuous spin rotation in ferromagnetic nanoelements in periodic electrode array patterns. Specifically, we developed Finite Elements Method (FEM) models to design nanoscale periodic magnetic particle arrays, which are used as the basis of an electrically smallmagnetic dipole antenna. We studied multiple configurations of nano-dipole antenna arrays and have determined unique methods for controlling the dipoles . The array configurations and device design structures determined in Phase I provide a strong basis for the fabrication of thin film, high radiation power density magnetic dipole elements for use in antenna applications. During Phase II, the team will prototype the antenna for operation in UHF band, develop necessary evaluation board (input matching and feed network) for the antenna and demonstrate its performance with measurements in anechoic chamber.; BENEFIT: This technology has a tremendous potential for both military and commercial platforms. Current antenna designs rely primarily on the electromagnetic resonance characteristic of anelectrically conductive antenna structure. This results in large antenna sizes and makes communication and SIGINT capability at VHF and UHF frequencies challenging for a wide range of platforms, but most notably small UAS systems. Our proposed Multiferroic based small antenna technology allows for developing extremely small antennas (lambda/100) - Antenna on IC and integrating these extremely small antennas on UAS airframe for VHF andUHF applications.less","749,971",2016,2018
0,Scaled Transonic Dynamic Aeroelasticity Through Wind Tunnel Testing (ST-DAWTT),United States Department of the Air Force,to alan arslan,"ABSTRACT: In Phase II of this research, Creative Aero Engineering Solutions (CAES) and its academic partner University of California Los Angeles (UCLA) will design, fabricate, and test a semispan model based on the novel aeroelastic models analyzed in Phase I. The objectives are to develop a physics-based understanding of transonic aeroelasticity near Mach 1, and to provide high-fidelity experimental data for validating aeroelastic codes. The wind tunnel tests will, for the first time, explore the Mach number freeze phenomenon and its role in natural mode flutter instabilities and shaping the transonic ""chimneys"" in the flutter boundary. The experimental data sets obtained during Phase II will enable the designer to optimize aeroelastic stability margins and control effectiveness in the early stages of design process. This capability will not only result in more optimal designs, but will also mitigate the risks associated with the development of future high-speed aircraft by avoiding aeroelastic surprises during flight tests. Both outcomes are of significant relevance to both the Air Force as well as to the civilian aircraft industry. The resulting process will be rendered robust and repeatable to the point of fast and affordable on-demand manufacturing for future commercialization purposes during Phase III. BENEFIT: Commercial applications involve : * Enhanced Finite Element Analysis (FEA) and Computational Fluid Dynamics (CFD) methods for non-linear fluid structure interactions (unique capability to transition to government and aerospace industry) * Fast wind-tunnel aeroelastic wind-tunnel model manufacturing capabilities that could be generalized to design, validaion, and testing of full scale morphing Uninhabited Air Vehicles ( UAV)less","749,965",2014,2015
0,Advanced Transport Damage Tolerant GLARE Hybrid Bonded Wing Structure,United States Department of the Air Force,to David Kordonowy,"ABSTRACT: Aurora and UCLA""s Phase I efforts demonstrated the feasibility of the synthesis of advanced hybrid materials, unitized structure, and metallic-composite bonding on the Air Force Next Generation Transport. The X-55 Advanced Composite Cargo Aircraft (ACCA) wing was used to demonstrate the damage tolerance of Glass-Reinforced Aluminum Laminate (GLARE), which is an advanced hybrid material with outstanding fatigue and impact resistance, as well as high static strength. Three-dimensional woven fiberglass Pi-Preforms were used to joint the members together as a unitized structure. Advanced composite components were able to be combined with the metallic structure through the use of the Pi-Preform joints without the galvanization issue associated with composite-metallic bonded structure. A weight savings of 35% was shown for the outboard wing leading edge assembly compared with the existing X-55 ACCA wing leading edge. In Phase II Aurora proposes to develop a structural component, such as the outboard leading edge of the X-55 ACCA Demonstrator Vehicle, to demonstrate the benefits of GLARE unitized structure through manufacturing and testing of a representative article. UCLA will extend their multi-scale constitutive model to predict damage tolerance within the GLARE panels and metallic-composite bonded Pi-Preform joints. BENEFIT: Moving to a unitized GLARE structure on the X-55 ACCA Demonstrator Vehicle will provide a roughly 35% weight reduction in the outboard leading edge due to the improved damage tolerance of GLARE material. Reductions in weight and maintenance costs associated with fatigued and damaged components are possible throughout an aircraft using GLARE material in unitized structural configurations with fiberglass Pi-Preforms. Potential applications include the leading edge of the wing, lower wing skin, cargo doors, and access panels onboard the Air Force Next Generation Transport as well as many other platforms. Aurora envisions applications after demonstration on the X-55 ACCA Demonstrator Vehicle to initially include the Northrop Grumman GlobalHawk and Sikorsky CH-53K S-92 platforms, for which Aurora currently fabricates metallic and composite components. Additionally, the multi-scale constitutive models developed will allow for the publication of new damage tolerant design techniques for use by government and industry.less","749,946",2010,2011
0,AgileBeam Reconfigurable Free Space Optical Communication System,United States Department of the Air Force,to Todd Chauvin,"Free Space Optical (FSO) communication systems provide many benefits for satellite communications, including high data rates and low Size, Weight and Power (SWaP) compared to traditional RF communication systems. Additionally, FSO systems operate without RF emissions and are inherently immune to RF interference and jamming. The narrow optical beams and small Field-of-View of the optical receivers also make FSO systems LPI/LPD and difficult to disrupt by intentional jamming. Space-based FSO systems have been demonstrated, and are being considered for many upcoming commercial and military satellite systems. However, widespread adoption of space-based FSO systems has not occurred, partly due to the custom nature of most FSO systems. For each space-based application, a custom FSO system is typically developed. What is needed is a reconfigurable FSO terminal that can be used for a wide variety of missions, including operation in LEO, MEO and GEO orbits, and supporting both crosslink and up/down-link operation. To address this need, SA Photonics proposes the development of the AgileBeam space-based FSO system. AgileBeam is based on our CrossBeam FSO system and software-defined reconfigurability to enable the system to support a wide range of space-based applications.less","749,923",2019,2021
