,title,funder,investigator,abstract,funding_amount_usd,start_year,end_year
0,Pushing the Limit of Two-Dimensional Semiconductor Transistors through van der Waals Integration,United States Department of the Navy,to Xiangfeng Duan,"Title: Pushing the Limit of Two-Dimensional Semiconductor Transistors through van der Waals Integration Objective:To enable optimum two-dimensional semiconductor (2DSC)/metal contact and 2DSC/dielectric interface and create high-speed transistors from 2DSCs, with unprecedented performance. Specifically, to avoid direct lithography on the delicate 2DSC surface, we will fabricate the entire gate stack and contact electrodes on a sacrificial substrate and physically transfer them onto 2DSC with minimum damage within dielectric/2DSC interface and metal/2DSC interface.Approach:To overcome previous limitations and achieve superior RF performance, here wepropose a novel approach to fabricate MoS2 transistors with sub-100 nm gate length using a metal/dielectric stack as the self-aligned top gate, and van der Waal transferred metal as the self-aligned source drain electrodes, both of which are integrated with MoS2 through a physical assembly process without damaging the gentle and dedicate two-dimensional semiconductor (2DSC) surface. In particular, the physical assembly and vdW integration of both gate stack and contact electrodes avoid any direct aggressive processes on MoS2 to prevent any integration-induced damage to the atomically thin 2DSCs, thus ensuring pristine 2DSC/dielectric interface with little trapping states and excellent channel mobility, and nearly ideal metal/semiconductor interface essentially free of interface Fermi level pinning and with minimized contact resistance. The self-aligned source-drain electrodes minimize the access resistance and parasitic capacitance and maximize the device transconductance. SOW:Key Tasks and MilestonesYear 1: Fabrication and optimization of the gate stack, source-drain contactsand the transfer process, and development of the transfer process for transistors on silicon substrate with optimized DC performance.Year 2: Integration of the gate stack, source-drain contacts with 2Dsemiconductors for creating transistors on glass substrate withminimized parasitic capacitance and optimized RF performance.Year 3: Optimization of the van der Waals integrated 2D transistors and thecreation of RF circuits.less","442,569",2018,2021
0,Crowdsourcing Assessments and Evaluations,United States Department of the Navy,to Mihaela van der Schaar,"Statement of Work:In many operation settings, the performance (or ability, experience, knowledge, productivity, etc.) of an agent(professionals, researchers, authors etc.) cannot be easily assessed by an objective ~test~ but rather must be inferred from the reports or evaluations of other agents. In such settings, it is necessary or convenient that the evaluation process be ~crowdsourced~. However, crowdsourcing systems for evaluations/assessments often do not operate well because ~peer~ evaluations may be unreliable for any of a number of reasons: the evaluator may be malicious or incompetent or may simply not exert sufficient effort to provide an accurate assessment because effort is not rewarded.To ensure that crowdsourcing systems for evaluations/assessments work well it is necessary to identify high quality (accurate) feedback and to provide incentives for evaluators to provide such feedback, and in particular, to encourage effort and cooperative behavior and discourage low quality feedback due to limited effort spent, incompetence ormalicious behavior. The goal of this project is to construct a system for crowdsourcing assessments that can operate in many different communities/types of agents in an efficient, fair and robust manner. The theory and the associated constructions willneed to enable us to deal with the incentive problems posed by assessments in a large variety of communities of professionals, including communities consisting of a large number of anonymous, heterogeneous (have different needs, preferences, capabilities, information etc.) agents, and in which the peers have heterogeneous ability and evaluations are (known to be) imperfect.Objective:The object of this research is to develop formalisms, methods and an associated ~crowdsourcing~ platform foreffectively performing evaluations/assessments using other peers. The methods developed will be very widelyapplicable in many scenarios, including those mentioned above ~ indeed to almost all settings in which the quality of the work of an individual is subjective, or cannot be directly tested or easily observed/evaluated by the authority ~ but can be observed/evaluated by peers.Approach:In this project the PI aims to develop a systematic framework for modeling the problem of crowdsourcing assessments, a theory for analyzing it, methods for solving it, algorithms for designing and implementing it and a prototype for validating it. Typically, evaluations require costly effort and do not convey direct benefit. This will mean that, in the absence of incentives, evaluators will not want to put in the effort needed to evaluate others. However, as mentioned previously, evaluators are in turn evaluated by others (not necessarily those that they evaluated), so social reciprocity can be used in the design of the crowdsourcing platform for assessments in such a way that if the evaluator does exert effort and provides an accurate evaluation, then he/she can be rewarded for this effort in the form of being assigned better evaluators in the future; this is desirable (at least for agents who produce good work) because better evaluatorsproduce more accurate assessments of quality and also because it is believed that the quality of an agent as a worker will improve if he/she receives high quality evaluations. A succinct way to keep track of the evaluator~s history of past assessments and their qualities is through a rating/reputation system. The rating will be used to reward/punish agentsthrough the assignment of better/worse sets of evaluators.Overall Merit and ONR Mission/Relevance:Providing high quality, competent and truthful assessments of the work performed by various agents - the ~agents~ may be individuals or teams of individuals ~ is of paramount importance for the well-functioning of any organization and/or operation, including the Navy and/or Naval operations. The systems developed in this project for crowdsourcing evaluations will be relevant to numerous Navy operaless","430,000",2016,
0,Parallel Optimization with Input Delays,United States Department of the Navy,to Wotao Yin,"Technological advances in data gathering have led to a rapid proliferation of big data in diverse areas. In order to make sense of this massive amount of data, new computational approaches are needed for scientists and engineers to analyze their data and make decisions. Owing much to the key roles that `1 and other nonsmooth functions play in the areas of statistical and machine learning, neural network training, and image processing, nonsmooth optimization hasbecome a common type of problem in data sciences. With the increasing number of researchers using nonsmoothoptimization in their research, there is a pressing need for solvers that can handle a difficult, important subclass ofproblem: nonsmooth nonseparable optimization.Nonsmooth nonseparable functions (including the indicator functions corresponding to global constraints) arise in avariety of optimization problems: linear and second-order cone programming, the recovery of tree/graph/transformedsparsesignals, and distributed consensus problems. Improved ability for solving large-scale and distributed instancesof these problems will translate to more rapid, accurate information processing and decision making, which areimportant for the Navy applications.The PI proposes a project that focuses on solving a set of large-scale optimization problems that are possibly bothnonsmooth and nonseparable. This proposal encompasses two aspects:(1) Development of parallel algorithms for nonsmooth nonseparable optimization;(2) Development of asynchronous parallel algorithms and their convergence theory.New decomposition methods, coordinate-friendly structures, analysis of iterations with input delays, and an opensourcepackage that implement the algorithms in (1) and (2), will be introduced.Significance and impact. Current state of the art methods have been shown to be inefficient or inapplicable when anonsmooth nonseparable function is introduced to optimization. Hence, modeling big data problems using nonsmoothnonseparable functions has been avoided. While many algorithms have been developed for nonsmooth problems,their efficiency is tied to the separability of the nonsmooth functions. By providing easy-to-use methods, the PI willexpand the solvable problem formulations beyond the typical nonsmooth separable functions such as `1 norm andconstraints on individual (or non-overlapping groups of) variables. The proposed work opens the door for researchersto work on new problems.The developed algorithms will be realized as a computational toolbox and made available on GitHub. The toolboxallows researchers to solve a wide class of problems, to test and refine their theories, and to quickly involve students incurrent research problems. Moreover, the toolbox, which is open-course and well-documented, is extensible andactively developed. Other researchers can add their own features and algorithms to the toolbox.While the problems and algorithms are of great interest to a large scientific community, an expected outcome of thisproject will be the training of the next generation of computational scientists working in optimization-related fields.Researchers and students in mathematics, computer science, and engineering have the necessary background tolearn and use the results of this research. Thus, there is an opportunity to form cross-disciplinary research teams.Furthermore, by having a set of easily used computational tools, it is much easier for undergraduate students toparticipant in research projects through exploring specific examples or conducting numerical experiments. Studentsand postdoctoral researchers working on aspects of this proposal will get valuable research experience designingoptimization algorithms and developing computational software.less","420,000",2017,
0,ARO 5.2.3 Actionable Information-Based Inference for Control and Interaction with Dynamic Scenes,United States Department of the Army,to Stefano Soatto,"The objective of this project is to establish analytical and computation approaches lo enabling accomplishing decision and control tasks on physical scenes involving multiple moving objects, based on visual data and its integration with 0ther sensory modalities including inertial nnd range. The long-term goal is to develop a theory of information for decision and control, where complex sensors provide ""actionable information"" through analysis that explicitly takes into account large nuisance variability due to phenomena that affect the data, but are otherwise irrelevant to the task at hand. Specifically, this project focuses on the analysis and inference of independently moving objects or ""agents"", where the relations between the different objects is time-varying and explicitly modeled, which is a necessary step to enable interaction with complex and dynamic scenes. The first step is to extend visual inference tools developed for static scenes, to independently moving objects. Once independently moving objects are detected and their attributes inferred, the second step is to explicitly model thcir (time-varying) relations, so as to support queries and actions not just about object identities, bul also about their relations, including interrelations, actions and events. In some cases, the relation between sensory input and actions could be represented directly, without the need for a ""state"" or an explicit representation of the physical environment. Once the relation between objects (which may include ""agents"" as well as the environment itself) is abstracted, some simple tasks could be explicitly enumerated, and efficiently encoded. thus providing a representation not of the data, and not of the scene, but directly of the data-to-action maps. The research is organized in the following interrelated and complementary topics: (1) Deformable Object Tracking: Extending Actionable lnformation Theory to Dynamic Scenes (2) From Active Sensing to Interactive Sensing (3) From Active Sensing lo lnterventive Sensing (4) Action Coding and Representation (5) Location Recognition and ""Loop Closure""less","419,999",2015,2018
0,"The Effect of Domain size in Polymorphic Activity in Soda-lime Glass under Extreme Conditions of Temperature, Strain Rate and Pressure",United States Department of the Navy,to Vijay Gupta,"Title:The Effect of Domain size in Polymorphic Activity in Soda-lime Glass under Extreme Conditions of Temperature, Strain Rate and PressureAbstract:Study the effect of domain size in polymorphic transformations by subjecting nano andmicro-pillars of soda-line glass, quartz, and sapphire of varying diameters (100 nm-2000 nm)and aspect ratios (1 to 2) to (a) axial shock compression using the existing Laser Spallation ShockFacility, and (b) ultrahigh pressures (>20 GPa) using a new setup that utilizes in-plane cylindrically focused laser-generated stress waves. These series of experiments will provide valuable experimental data for development of new models and also uncover if small domain size will result in the formation of high density polymorphs at significantly reduced pressure and temperature conditions.less","417,000",2017,2020
0,Coherent Beam Combining of Mid-IR Lasers,United States Department of the Army,to C. Kumar Patel,"Many military applications require efficient optical sources producing several to hundred watts in continuous-wave (CW) or quasi-continuous-wave (QCW) operation at room temperature (RT) in the MWIR (3-5 micron) and LWIR (8-12 micron) regions. While QCLs have become the sources of choice in these spectral regions, the only realistic option to attain hundred-watt power level with good beam quality is to coherently combine multiple QCL emitters into a single output beam. In Phase I, we have performed analysis of QCL arrays, and showed that this approach is well suited for necessary power scaling. We have developed a design, which should produce 10 W of output power at RT. In Phase II, we will develop the processing required for the fabrication of such arrays, fabricate and characterize prototype devices. We will design, fabricate, and characterize a second generation of devices with higher output power of several tens of watts. Furthermore, we will develop a plan for extending the performance of these arrays up to 100 W. Our approach, leveraging advanced material growth and fabrication, will result in robust, compact, and cost-effective monolithic QCL beam combining solutions exceeding the requirements of this solicitation, and provide the military with the required laser sources.less","400,478",2013,2015
0,Understanding rare event formation and ultrafast dynamics in chip-scale nonlinear oscillators: Spectro-temporal signatures of higher-order rogue solitons and sub-cycle synthesis,United States Department of the Navy,to Chee Wei Wong,"Nonlinear second- and third-order parametric processes in chip-scale high quality factor (Q) resonators provide a robust and exciting platform to understand ultrafast dynamical processing. Seeded by spontaneous noise, parametric regimes such as modulation instability, Turing patterns, dissipative solitons, and chaos have been observed. These chip-scale nonlinear oscillators -- spanning over thousands of coupled and phase-locked frequency modes further provide a fertile ground for understanding pattern and rare event formation, along with their concurrent ultrafast dynamics. These have impact in Navy applications from fundamental clocks for RF and optical communications, synchronization and timing transfer between clock-to-clock, the absolute definition of the optical frequency standard, microwave (radar X-band) to optical clockwork, ultrafast chaos generation for secure communications, and high-power laser synthesis and spectroscopy. In this program we propose to advance two associated experimental efforts: (Thrust I) examining and understanding the ultrafast spectro-temporal signatures of higher-order rogue solitons, and (Thrust II) the octave-level fewfemtosecond nonlinear comb oscillator synthesis.less","400,000",2021,2023
0,DYNAMICS OF ACOUSTICALLY COUPLED COMBUSTION INSTABILITIES RELEVANT TO ROCKET PROPULSION SYSTEMS,United States Air Force,to ANN KARAGOZIAN,"Over the past several years, experiments at UCLA have explored several alternative fuel injectors, for a range of flow conditions and for different acoustic excitation conditions, many of which are similar to or exceed the relative amplitude of acoustic excitation performed at AFRL.less","399,231",2022,2025
0,Area 9 Material Sciences: Fundamental Advances in Predicting Aeolian Transport: Moving Beyond the Fluid Threshold and Precipitation Control Paradigms,United States Department of the Army,to Jasper Kok,The overarching objectives of the proposal are: ¥ Task 1: Develop a probabilistic model for sand transport occurrence over dry sand. ¥ Task 2: Test hypothesis that soil moisture from precipitation rarely inhibits aeolian transport. ¥ Task 3: Utilize the probabilistic model of transport occurrence (Task 1) and the simplified description of soil moisture effects (Task 2) to derive improved relations for sand and dust fluxes.less,"398,922",2015,2018
0,Sub fJ/bit III-V Nanopillar Optical Link,United States Air Force,to Diana Huffaker,"This proposal investigates a III-V nanophotonic transceiver on SOI substrates to realize an optical link with and energy-to-data ratio of < 10 fJ/bit at > 67 GHz. The III-V nanophotonic transceiver combines a directly modulated Nanopillar Array BandEdge Laser (NA-BEL) for the transmitter such that the cavity mode overlaps with an InGaAs gain region and a Plasmonically Coupled Single Nanopillar Photodiode (PC-SNP) for a high sensitivity receiver. Both laser and detector will be optimized independently and monolithically integrated on a SOI platform to realize the optical link. In terms of the NA-BEL on SOI grating substrate, a nanophotonic design will be developed for high quality factor laser using InxGa1-xAs (where x > 0.53) nanopillars. Temperature dependent photoluminescence and electroluminescence studies will be performed to characterize the feasibility of room temperature lasing operation. In terms of the PC-SNP on a waveguide, single pillar growth morphology will be investigated and the photocurrent generation of the PC-SNP with several junction configurations in the pillar. The final demonstration will be an energy efficient optical link, they will fabricate a prototype with on-chip NA-BEL and PC-SNP and demonstrate electrically driven lasing of NA-BEL and electrically biased PC-SNP.less","397,856",2015,2018
0,8.3 Microbiology - Increased Translation Error Rates and Long-term Survival,United States Department of the Army,to Beth Lazazzera,"Quality control of accurate protein translation is governed by the specificity of aminoacyl-tRNA synthetases (aaRS), enzymes which are responsible for correct charging of tRNAs with their cognate amino acid. Loss of this quality control either through misincorporation or defective editing will result in ÒmistranslationÓ leading to a loss of protein structural and functional integrity. While mistranslation is normally rare, it has been recently observed that E. coli cells that lack the quality control function of an aaRS have a competitive advantage over wild-type cells under long-term survival conditions and that these quality control mutants have a higher mutation rate. To further probe this seemingly paradoxical phenomenon, this proposal seeks to determine how translation errors contribute to survival, whether translation errors directly influence the mutation rate and to assess the relative benefit of different translation errors. It is hypothesized that elevated translation errors improve survival during long-term growth (where the growth rate is considerably slowed relative to exponential phase) by increased translational capacity in the face of dwindling resources and/or by translation of a more diverse proteome. In editing-defective E. coli cells (containing a mutant PheRS leading to misincorporation of Tyr for Phe) grown under long term conditions, altered increased translation capacity will be assessed by the loss of metabolic and transcriptomic markers characteristic of the stringent response (which normally shuts down the translational machinery during amino acid starvation) and by polysome profiling which provides an indication of active 70S ribosomes associated with mRNA. To assess the presence of a more diverse proteome, mass spectrometry-based assays will be used to quantify the mistranslation level of targeted proteins known to have central roles in translation. To establish a possible link between mistranslation and higher mutation rates, editing defective cells will be assessed for an abundance of the GASP phenotype by competing aged versus younger cells grown through stationary phase. Overall mutational frequency and the mutational spectrum of editing-defective cells exhibiting a GASP phenotype will be assessed by genomic sequencing and compared against the sequence of a wild-type strain exhibiting the GASP phenotype. To determine if different translation errors are equally beneficial, a second editing-defective strain will be constructed (mutant of IleRS which should result in misincorporation of either Val or Leu for Ile) and assessed for its ability to compete with wild-type under long-term stationary phase. Overall mutational frequency will be determined and effects of a double mutant (editing defective alleles of IleRS and PheRS) will be assessed.less","390,000",2015,2018
0,(DURIP-20) PROGRAMMABLE VARIABLE ANGLE PHOTO-THERMO-MECHANICAL TESTING SYSTEM FOR CHARACTERIZING PHOTO ADAPTIVE MATERIALS,United States Air Force,to Ximin He,"This proposal aims to establish new characterization capabilities for designing and investigating non- conventional Artificial Homeostatic Multifunctional Material Microsystems that are capable of real- time sensing-and-adapting to regulate local conditions including temperature, air pressure, and light at a constant level against environment perturbations. This will enable the research capability and enhance the research quality of a AFOSR YIP project, titled “Bioinspired Artificial Homeostatic Multifunctional Material Microsystems (AHM3) based on Self-sustaining Autonomic Adaptive Structures” (Award Number: FA9550-17-1-0311). Achieving such real-time autonomous regulation of local light conditions relies on creating a series of smart hydrogel materials photo-thermo- mechanically responsive to varying incident photonic stimuli. Critical to the success of this non- conventional autonomic adaptive system development is to carefully and systematically characterize multiple parameters simultaneously, specifically to (1) illuminate the photo-responsive material from different and constantly varying angles and at the same time (2) real-time capture the microscale actuation and analyze reconfiguration three-dimensionally and quantitatively measure (temporal factor) and map (spatial factor) the local temperature and configuration. However, there is no commercial equipment that allows for multifunctional visible-and-IR orthogonal imaging plus thermal/optical measurements with precise environment control. Hence, herein we propose to build a multifunctional dynamic microsystem testing platform, based on a variable-angle illuminating system equipped with a thermal controller and a mechanical tester.less","386,858",2020,2021
0,A DNS Study on Hypersonic Boundary-Layer Receptivity and a New Transition Control Strategy by Surface Roughness,United States Air Force,to Xiaolin Zhong,The objective of this proposal is to conduct computational and Linear Stability Theory (LST) based theoretical research on the fundamental mechanisms of hypersonic boundary-layer instability and receptivity in the context of the relationship between synchronization points and surface roughness location and their effects on transition control. Also the aim is to develop and validate a new passive transition control strategy using strategically-placed 2-D and 3-D surface roughness elements that is expected to enable AFRL researchers to use 3-D high order cut-cell code developed at UCLA to simulate a discrete boundary layer trip on HIFiRE-1 type vehicles.less,"385,378",2015,2018
